[{"feature": "parking_tickets", "date": "2016-05-17T00:00:00Z", "location": {"latitude": 42.38404209999999, "longitude": -71.1370766}, "category": "NO PARKING"}, {"feature": "parking_tickets", "date": "2014-01-04T15:50:00Z", "location": {"latitude": 42.38404209999999, "longitude": -71.1370766}, "category": "METER EXPIRED"}]
